{"assessment":{"assessment":{"assessment_id":"IT-CRQ-001","assessment_version":1,"asset_type":"Organisation","currency":"USD","domain":"IT","organisation":"Example Financial Institution","reporting_basis":"Prudent","sector":"Financial Services"},"domain_inputs":{"controls":[{"control_id":"C01","coverage":0.75,"evidence_ids":["IT-CONTROL-C01"],"maturity":"Developing","test_result":null,"tested":null},{"control_id":"C02","coverage":0.75,"evidence_ids":["IT-CONTROL-C02"],"maturity":"Developing","test_result":null,"tested":null},{"control_id":"C03","coverage":0.75,"evidence_ids":["IT-CONTROL-C03"],"maturity":"Developing","test_result":null,"tested":null},{"control_id":"C04","coverage":0.75,"evidence_ids":["IT-CONTROL-C04"],"maturity":"Developing","test_result":null,"tested":null},{"control_id":"C05","coverage":0.75,"evidence_ids":["IT-CONTROL-C05"],"maturity":"Developing","test_result":null,"tested":null},{"control_id":"C06","coverage":0.75,"evidence_ids":["IT-CONTROL-C06"],"maturity":"Developing","test_result":null,"tested":null},{"control_id":"C07","coverage":0.75,"evidence_ids":["IT-CONTROL-C07"],"maturity":"Developing","test_result":null,"tested":null},{"control_id":"C08","coverage":0.75,"evidence_ids":["IT-CONTROL-C08"],"maturity":"Developing","test_result":null,"tested":null},{"control_id":"C09","coverage":0.75,"evidence_ids":["IT-CONTROL-C09"],"maturity":"Developing","test_result":null,"tested":null},{"control_id":"C10","coverage":0.75,"evidence_ids":["IT-CONTROL-C10"],"maturity":"Developing","test_result":null,"tested":null},{"control_id":"C11","coverage":0.75,"evidence_ids":["IT-CONTROL-C11"],"maturity":"Developing","test_result":null,"tested":null},{"control_id":"C12","coverage":0.75,"evidence_ids":["IT-CONTROL-C12"],"maturity":"Developing","test_result":null,"tested":null},{"control_id":"C13","coverage":0.75,"evidence_ids":["IT-CONTROL-C13"],"maturity":"Developing","test_result":null,"tested":null},{"control_id":"C14","coverage":0.75,"evidence_ids":["IT-CONTROL-C14"],"maturity":"Developing","test_result":null,"tested":null},{"control_id":"C15","coverage":0.75,"evidence_ids":["IT-CONTROL-C15"],"maturity":"Developing","test_result":null,"tested":null}],"domain":"IT","exposure_model_enabled":false,"financial_exposure":{"annual_payment_value":5000000000,"annual_revenue_at_risk":1000000000,"bi_loss_factor":1,"critical_endpoints":5000,"critical_servers":500,"customers":2000000,"employees":10000,"sensitive_records":5000000},"frequency_adjustments":{"CYBERCRIMINAL_ACTIVITY":1,"GEOGRAPHY_THREAT_MULT":1,"HACKTIVIST_ACTIVITY":1,"MALICIOUS_INSIDER_ACTIVITY":1,"NATION_STATE_ACTIVITY":1,"ORGANISATION_EXPOSURE_MULT":1,"PRUDENCE_FREQUENCY_FACTOR":1.25},"impact_overrides":[{"evidence_id":null,"p50":null,"p99":null,"parameter_id":"NOTIFICATION_PER_RECORD","scenario_id":null},{"evidence_id":null,"p50":null,"p99":null,"parameter_id":"CREDIT_MONITORING_PER_RECORD","scenario_id":null},{"evidence_id":null,"p50":null,"p99":null,"parameter_id":"FORENSIC_DAILY","scenario_id":null},{"evidence_id":null,"p50":null,"p99":null,"parameter_id":"EXTERNAL_CYBER_DAILY","scenario_id":null},{"evidence_id":null,"p50":null,"p99":null,"parameter_id":"RESTORATION_DAILY","scenario_id":null},{"evidence_id":null,"p50":null,"p99":null,"parameter_id":"LEGAL_DAILY","scenario_id":null},{"evidence_id":null,"p50":null,"p99":null,"parameter_id":"ENDPOINT_REPAIR","scenario_id":null},{"evidence_id":null,"p50":null,"p99":null,"parameter_id":"SERVER_REPAIR","scenario_id":null},{"evidence_id":null,"p50":null,"p99":null,"parameter_id":"AFFECTED_ENDPOINT_SHARE","scenario_id":"SC_DISR"},{"evidence_id":null,"p50":null,"p99":null,"parameter_id":"AFFECTED_RECORD_SHARE","scenario_id":"SC_DISR"},{"evidence_id":null,"p50":null,"p99":null,"parameter_id":"AFFECTED_SERVER_SHARE","scenario_id":"SC_DISR"},{"evidence_id":null,"p50":null,"p99":null,"parameter_id":"AFFECTED_SERVICE_SHARE","scenario_id":"SC_DISR"},{"evidence_id":null,"p50":null,"p99":null,"parameter_id":"CHURN_REVENUE_SHARE","scenario_id":"SC_DISR"},{"evidence_id":null,"p50":null,"p99":null,"parameter_id":"CYBER_DAYS","scenario_id":"SC_DISR"},{"evidence_id":null,"p50":null,"p99":null,"parameter_id":"DIVERTED_SHARE","scenario_id":"SC_DISR"},{"evidence_id":null,"p50":null,"p99":null,"parameter_id":"DOWNTIME_DAYS","scenario_id":"SC_DISR"},{"evidence_id":null,"p50":null,"p99":null,"parameter_id":"EXTORTION_DIRECT","scenario_id":"SC_DISR"},{"evidence_id":null,"p50":null,"p99":null,"parameter_id":"FRAUD_RECOVERY_RATE","scenario_id":"SC_DISR"},{"evidence_id":null,"p50":null,"p99":null,"parameter_id":"IR_DAYS","scenario_id":"SC_DISR"},{"evidence_id":null,"p50":null,"p99":null,"parameter_id":"LEGAL_DAYS","scenario_id":"SC_DISR"},{"evidence_id":null,"p50":null,"p99":null,"parameter_id":"MONITORING_TAKEUP","scenario_id":"SC_DISR"},{"evidence_id":null,"p50":null,"p99":null,"parameter_id":"PAYMENT_FLOW_DAYS","scenario_id":"SC_DISR"},{"evidence_id":null,"p50":null,"p99":null,"parameter_id":"POST_EVENT_REVENUE_SHARE","scenario_id":"SC_DISR"},{"evidence_id":null,"p50":null,"p99":null,"parameter_id":"REGULATORY_REVENUE_SHARE","scenario_id":"SC_DISR"},{"evidence_id":null,"p50":null,"p99":null,"parameter_id":"RESTORE_DAYS","scenario_id":"SC_DISR"},{"evidence_id":null,"p50":null,"p99":null,"parameter_id":"AFFECTED_ENDPOINT_SHARE","scenario_id":"SC_DATA"},{"evidence_id":null,"p50":null,"p99":null,"parameter_id":"AFFECTED_RECORD_SHARE","scenario_id":"SC_DATA"},{"evidence_id":null,"p50":null,"p99":null,"parameter_id":"AFFECTED_SERVER_SHARE","scenario_id":"SC_DATA"},{"evidence_id":null,"p50":null,"p99":null,"parameter_id":"AFFECTED_SERVICE_SHARE","scenario_id":"SC_DATA"},{"evidence_id":null,"p50":null,"p99":null,"parameter_id":"CHURN_REVENUE_SHARE","scenario_id":"SC_DATA"},{"evidence_id":null,"p50":null,"p99":null,"parameter_id":"CYBER_DAYS","scenario_id":"SC_DATA"},{"evidence_id":null,"p50":null,"p99":null,"parameter_id":"DIVERTED_SHARE","scenario_id":"SC_DATA"},{"evidence_id":null,"p50":null,"p99":null,"parameter_id":"DOWNTIME_DAYS","scenario_id":"SC_DATA"},{"evidence_id":null,"p50":null,"p99":null,"parameter_id":"EXTORTION_DIRECT","scenario_id":"SC_DATA"},{"evidence_id":null,"p50":null,"p99":null,"parameter_id":"FRAUD_RECOVERY_RATE","scenario_id":"SC_DATA"},{"evidence_id":null,"p50":null,"p99":null,"parameter_id":"IR_DAYS","scenario_id":"SC_DATA"},{"evidence_id":null,"p50":null,"p99":null,"parameter_id":"LEGAL_DAYS","scenario_id":"SC_DATA"},{"evidence_id":null,"p50":null,"p99":null,"parameter_id":"MONITORING_TAKEUP","scenario_id":"SC_DATA"},{"evidence_id":null,"p50":null,"p99":null,"parameter_id":"PAYMENT_FLOW_DAYS","scenario_id":"SC_DATA"},{"evidence_id":null,"p50":null,"p99":null,"parameter_id":"POST_EVENT_REVENUE_SHARE","scenario_id":"SC_DATA"},{"evidence_id":null,"p50":null,"p99":null,"parameter_id":"REGULATORY_REVENUE_SHARE","scenario_id":"SC_DATA"},{"evidence_id":null,"p50":null,"p99":null,"parameter_id":"RESTORE_DAYS","scenario_id":"SC_DATA"},{"evidence_id":null,"p50":null,"p99":null,"parameter_id":"AFFECTED_ENDPOINT_SHARE","scenario_id":"SC_INT"},{"evidence_id":null,"p50":null,"p99":null,"parameter_id":"AFFECTED_RECORD_SHARE","scenario_id":"SC_INT"},{"evidence_id":null,"p50":null,"p99":null,"parameter_id":"AFFECTED_SERVER_SHARE","scenario_id":"SC_INT"},{"evidence_id":null,"p50":null,"p99":null,"parameter_id":"AFFECTED_SERVICE_SHARE","scenario_id":"SC_INT"},{"evidence_id":null,"p50":null,"p99":null,"parameter_id":"CHURN_REVENUE_SHARE","scenario_id":"SC_INT"},{"evidence_id":null,"p50":null,"p99":null,"parameter_id":"CYBER_DAYS","scenario_id":"SC_INT"},{"evidence_id":null,"p50":null,"p99":null,"parameter_id":"DIVERTED_SHARE","scenario_id":"SC_INT"},{"evidence_id":null,"p50":null,"p99":null,"parameter_id":"DOWNTIME_DAYS","scenario_id":"SC_INT"},{"evidence_id":null,"p50":null,"p99":null,"parameter_id":"EXTORTION_DIRECT","scenario_id":"SC_INT"},{"evidence_id":null,"p50":null,"p99":null,"parameter_id":"FRAUD_RECOVERY_RATE","scenario_id":"SC_INT"},{"evidence_id":null,"p50":null,"p99":null,"parameter_id":"IR_DAYS","scenario_id":"SC_INT"},{"evidence_id":null,"p50":null,"p99":null,"parameter_id":"LEGAL_DAYS","scenario_id":"SC_INT"},{"evidence_id":null,"p50":null,"p99":null,"parameter_id":"MONITORING_TAKEUP","scenario_id":"SC_INT"},{"evidence_id":null,"p50":null,"p99":null,"parameter_id":"PAYMENT_FLOW_DAYS","scenario_id":"SC_INT"},{"evidence_id":null,"p50":null,"p99":null,"parameter_id":"POST_EVENT_REVENUE_SHARE","scenario_id":"SC_INT"},{"evidence_id":null,"p50":null,"p99":null,"parameter_id":"REGULATORY_REVENUE_SHARE","scenario_id":"SC_INT"},{"evidence_id":null,"p50":null,"p99":null,"parameter_id":"RESTORE_DAYS","scenario_id":"SC_INT"},{"evidence_id":null,"p50":null,"p99":null,"parameter_id":"AFFECTED_ENDPOINT_SHARE","scenario_id":"SC_FRAUD"},{"evidence_id":null,"p50":null,"p99":null,"parameter_id":"AFFECTED_RECORD_SHARE","scenario_id":"SC_FRAUD"},{"evidence_id":null,"p50":null,"p99":null,"parameter_id":"AFFECTED_SERVER_SHARE","scenario_id":"SC_FRAUD"},{"evidence_id":null,"p50":null,"p99":null,"parameter_id":"AFFECTED_SERVICE_SHARE","scenario_id":"SC_FRAUD"},{"evidence_id":null,"p50":null,"p99":null,"parameter_id":"CHURN_REVENUE_SHARE","scenario_id":"SC_FRAUD"},{"evidence_id":null,"p50":null,"p99":null,"parameter_id":"CYBER_DAYS","scenario_id":"SC_FRAUD"},{"evidence_id":null,"p50":null,"p99":null,"parameter_id":"DIVERTED_SHARE","scenario_id":"SC_FRAUD"},{"evidence_id":null,"p50":null,"p99":null,"parameter_id":"DOWNTIME_DAYS","scenario_id":"SC_FRAUD"},{"evidence_id":null,"p50":null,"p99":null,"parameter_id":"EXTORTION_DIRECT","scenario_id":"SC_FRAUD"},{"evidence_id":null,"p50":null,"p99":null,"parameter_id":"FRAUD_RECOVERY_RATE","scenario_id":"SC_FRAUD"},{"evidence_id":null,"p50":null,"p99":null,"parameter_id":"IR_DAYS","scenario_id":"SC_FRAUD"},{"evidence_id":null,"p50":null,"p99":null,"parameter_id":"LEGAL_DAYS","scenario_id":"SC_FRAUD"},{"evidence_id":null,"p50":null,"p99":null,"parameter_id":"MONITORING_TAKEUP","scenario_id":"SC_